{
  "$schema": "https://json-schema.org/draft/2020-12/schema",
  "$id": "https://agentclash.dev/schemas/voice-artifact-manifest.schema.json",
  "title": "AgentClash Voice Artifact Manifest",
  "type": "object",
  "required": ["schema_version", "run_id", "run_agent_id", "voice_session_id", "artifacts"],
  "additionalProperties": true,
  "properties": {
    "schema_version": {
      "const": "2026-05-13"
    },
    "run_id": {
      "type": "string",
      "format": "uuid",
      "pattern": "^[0-9a-fA-F]{8}-[0-9a-fA-F]{4}-[0-9a-fA-F]{4}-[0-9a-fA-F]{4}-[0-9a-fA-F]{12}$",
      "not": {
        "pattern": "^0{8}-0{4}-0{4}-0{4}-0{12}$"
      }
    },
    "run_agent_id": {
      "type": "string",
      "format": "uuid",
      "pattern": "^[0-9a-fA-F]{8}-[0-9a-fA-F]{4}-[0-9a-fA-F]{4}-[0-9a-fA-F]{4}-[0-9a-fA-F]{12}$",
      "not": {
        "pattern": "^0{8}-0{4}-0{4}-0{4}-0{12}$"
      }
    },
    "voice_session_id": {
      "type": "string",
      "minLength": 1
    },
    "artifacts": {
      "type": "array",
      "minItems": 1,
      "uniqueItems": true,
      "items": {
        "$ref": "#/$defs/artifact_ref"
      },
      "allOf": [
        { "contains": { "properties": { "kind": { "const": "caller_audio" } }, "required": ["kind"] } },
        { "contains": { "properties": { "kind": { "const": "agent_audio" } }, "required": ["kind"] } },
        { "contains": { "properties": { "kind": { "const": "transcript_json" } }, "required": ["kind"] } },
        { "contains": { "properties": { "kind": { "const": "waveform_timeline_json" } }, "required": ["kind"] } },
        { "contains": { "properties": { "kind": { "const": "structured_output_json" } }, "required": ["kind"] } }
      ]
    },
    "metadata": {
      "type": "object",
      "additionalProperties": true,
      "properties": {
        "provider": { "type": "string" },
        "model": { "type": "string" },
        "input_language": { "type": "string" },
        "output_language": { "type": "string" },
        "transport": { "type": "string" },
        "streaming_mode": { "type": "string" }
      }
    }
  },
  "$defs": {
    "artifact_kind": {
      "enum": [
        "caller_audio",
        "agent_audio",
        "mixed_audio",
        "transcript_json",
        "waveform_timeline_json",
        "media_policy_report_json",
        "live_continuity_report_json",
        "video_sync_report_json",
        "raw_provider_trace_json",
        "structured_output_json",
        "redaction_metadata_json"
      ]
    },
    "artifact_ref": {
      "type": "object",
      "required": ["key", "kind", "location", "checksum_sha256"],
      "additionalProperties": true,
      "properties": {
        "key": {
          "type": "string",
          "minLength": 1
        },
        "kind": {
          "$ref": "#/$defs/artifact_kind"
        },
        "location": {
          "enum": ["local_path", "object_storage"]
        },
        "path": {
          "type": "string",
          "minLength": 1
        },
        "bucket": {
          "type": "string",
          "minLength": 1
        },
        "object_key": {
          "type": "string",
          "minLength": 1
        },
        "content_type": {
          "type": "string"
        },
        "size_bytes": {
          "type": "integer",
          "minimum": 0
        },
        "checksum_sha256": {
          "type": "string",
          "pattern": "^[0-9a-f]{64}$"
        }
      },
      "allOf": [
        {
          "if": {
            "properties": { "location": { "const": "local_path" } },
            "required": ["location"]
          },
          "then": {
            "required": ["path"],
            "properties": {
              "path": {
                "allOf": [
                  { "not": { "pattern": "^/" } },
                  { "not": { "pattern": "^[A-Za-z]:" } },
                  { "not": { "pattern": "(^|/)\\.\\.(/|$)" } }
                ]
              }
            },
            "not": {
              "anyOf": [
                { "required": ["bucket"] },
                { "required": ["object_key"] }
              ]
            }
          }
        },
        {
          "if": {
            "properties": { "location": { "const": "object_storage" } },
            "required": ["location"]
          },
          "then": {
            "required": ["bucket", "object_key"],
            "not": {
              "required": ["path"]
            }
          }
        }
      ]
    }
  }
}
