{
  "schema_version": "2026-05-13",
  "run_id": "33333333-3333-3333-3333-333333333333",
  "run_agent_id": "44444444-4444-4444-4444-444444444444",
  "voice_session_id": "voice-session-support-billing-seed-42",
  "artifacts": [
    {
      "key": "agent_audio",
      "kind": "agent_audio",
      "location": "local_path",
      "path": "artifacts/agent-turn-001.wav",
      "content_type": "audio/wav",
      "size_bytes": 30,
      "checksum_sha256": "d95869356aa66d7543cc9e21a4d68534034d2e91a33039b43bbac661d753fb49"
    },
    {
      "key": "caller_audio",
      "kind": "caller_audio",
      "location": "local_path",
      "path": "artifacts/caller-turn-001.wav",
      "content_type": "audio/wav",
      "size_bytes": 31,
      "checksum_sha256": "8f1415ad8c350a9547df1f13cd0836d7ffb8b459f587ad5d423f471fada0197e"
    },
    {
      "key": "mixed_audio",
      "kind": "mixed_audio",
      "location": "local_path",
      "path": "artifacts/mixed-session.wav",
      "content_type": "audio/wav",
      "size_bytes": 30,
      "checksum_sha256": "bcf377986e5fc44d7699278e4607bfbb6602d844cf512a678267d732dac3f2fc"
    },
    {
      "key": "raw_provider_trace",
      "kind": "raw_provider_trace_json",
      "location": "local_path",
      "path": "artifacts/raw_provider_trace.json",
      "content_type": "application/json",
      "size_bytes": 116,
      "checksum_sha256": "2b0de1dfc776dbe85ba4813758eeace9b99c310b0448ceb67659ef9e37be4031"
    },
    {
      "key": "redaction_metadata",
      "kind": "redaction_metadata_json",
      "location": "local_path",
      "path": "artifacts/redaction_metadata.json",
      "content_type": "application/json",
      "size_bytes": 76,
      "checksum_sha256": "0ea5f85848b67f3852ddf7292dd7d76a5d90e249f8aceac1699a301990d4eb1b"
    },
    {
      "key": "structured_output",
      "kind": "structured_output_json",
      "location": "local_path",
      "path": "artifacts/structured_output.json",
      "content_type": "application/json",
      "size_bytes": 131,
      "checksum_sha256": "f2475c7d3db11f1ff5aa8109cf9d3a8cbf75cc36eeadacc6f0e8f9083fbca989"
    },
    {
      "key": "transcript",
      "kind": "transcript_json",
      "location": "local_path",
      "path": "artifacts/transcript.json",
      "content_type": "application/json",
      "size_bytes": 328,
      "checksum_sha256": "6f380a999d74c02d7dd29d1c85eb0c697762abddff18215f6c424cdf167aee73"
    },
    {
      "key": "waveform_timeline",
      "kind": "waveform_timeline_json",
      "location": "local_path",
      "path": "artifacts/waveform_timeline.json",
      "content_type": "application/json",
      "size_bytes": 335,
      "checksum_sha256": "f33379b417f077ba9a8ab8427dbec74d3732ded995c4bb9563d119b251d52a0d"
    }
  ]
}
